thread_title,thread_url,thread_author,thread_datetime,snippet,doctors,clinics,city
[分享] 打完蘋果肌+補淚溝…從憔悴到年輕,https://www.pttweb.cc/bbs/facelift/M.1698246467.A.DB5,,2023-10-25T23:07:00,跟醫生諮詢時，其實我一開始是說要打淚溝和法令紋 我覺得這兩個地方最明顯的 但評估後醫生說我最嚴重的反而是蘋果肌 看上面那張照片就知道我的蘋果肌下垂很嚴重，幾乎是個大凹槽 法令紋的產生也和蘋果肌下垂有關 總之醫生說只補淚溝是沒有用的，要從蘋果肌補”上去” 我一聽覺得滿有道理的，之前別間醫生都沒跟我說要打蘋果肌 通常是我說要打淚溝他們就只給我打淚溝這樣 加上我也覺得這兩年工作很操勞，臉的狀態的確很差 所以就聽從醫師專業的意見吧,"但評估後醫生,總之醫生,之前別間醫生,所以就聽從醫師",,
[分享] 打完蘋果肌+補淚溝…從憔悴到年輕,https://www.pttweb.cc/bbs/facelift/M.1698246467.A.DB5,,2023-10-25T23:07:00,可以看見2 c.c.玻尿酸把我的蘋果肌填補了不少，整個澎了起來 雖然還是有黑眼圈啦，而且凹陷還剩一些 當下臉又有點腫腫的，不確定實際上效果如何 總之和診所約好下次回診時間後 診所就給了我消炎藥、止痛藥、消腫藥、胃藥讓我回家吃兩天,,總之和診所,
[分享] 打完蘋果肌+補淚溝…從憔悴到年輕,https://www.pttweb.cc/bbs/facelift/M.1698246467.A.DB5,,2023-10-25T23:07:00,", 1 F 直接從三十代變二十代耶！效果很好~~~ 10/26 00:17 , 1 F 推 gn15285 10/26 08:13, , 2 F 超美!!!!!!!!!! 10/26 08:13 , 2 F 推 weilori 10/26 09:24, , 3 F 請問價錢及醫生，謝謝 10/26 09:24 , 3 F 推 mscheng 10/26 11:35, , 4 F 效果很好欸～變少女了，很美！ 10/26 11:35 , 4 F 推 craze0302 10/26 13:15, , 5 F 請問價錢及...","請問價錢及醫生,請問價錢及醫師,想詢問醫師,請問醫師,問價格和診所醫師,請問醫生,詢問醫師,想詢問診所醫生,問價格跟診所醫生,請問價格與醫生,請問價格跟醫生,請問診所醫生,也想請問醫生,請問診所和醫生,想問價格和醫生,想問價格跟醫生,想請問醫師,想問醫生,想詢問醫生,想了解診所醫師,想詢問診所醫師,想詢問診所及醫生,請問診所醫師","想問價格和診所,想知道診所,想詢問診所,也想知道診所,請問價格跟診所,請問診所,想詢問醫生跟診所,想了解診所",
[問題] 請推薦我雙北或台南開淚溝手術的醫生已刪文,https://www.pttweb.cc/bbs/facelift/M.1698142851.A.BC2,,2023-10-24T18:20:00,[問題] 請推薦我雙北或台南開淚溝手術的醫生 - 看板facelift - PTT網頁版,開淚溝手術的醫生,,台南
[問題] 請推薦我雙北或台南開淚溝手術的醫生已刪文,https://www.pttweb.cc/bbs/facelift/M.1698142851.A.BC2,,2023-10-24T18:20:00,"[問題] 請推薦我雙北或台南開淚溝手術的醫生 已刪文 ＋收藏 分享 看板 facelift 作者 chiopin (......) 時間 2年前 發表 (2023/10/24 18:20) , 編輯 推噓 0 ( 0 推 0 噓 0 → ) 留言 0則, 0人 參與 , 最新 討論串 1/1",開淚溝手術的醫生,,台南
[問題] 眼袋手術有辦法根除雙層眼袋嗎？,https://www.pttweb.cc/bbs/facelift/M.1698114631.A.70E,,2023-10-24T10:30:00,", 14 F 可以問看看醫師要不要補淚溝 調整完整 10/25 15:07 , 14 F → Emilynxtp 10/25 15:07,",可以問看看醫師,,
[問題] 眼袋手術有辦法根除雙層眼袋嗎？,https://www.pttweb.cc/bbs/facelift/M.1698114631.A.70E,,2023-10-24T10:30:00,", 15 F 個人會有神很多～ 10/25 15:07 , 15 F 推 wmkkin 10/27 17:38, , 16 F 眼袋不是長出來的，是鬆弛導致脂肪墊下滑 10/27 17:38 , 16 F → wmkkin 10/27 17:38, , 17 F 只有手術拿掉眼下脂肪、放鬆皮下韌帶 10/27 17:38 , 17 F → wmkkin 10/27 17:39, , 18 F 填好該填的淚溝，有需要的話還要讓蘋果肌 10/27 17:39 , 18 F → wmkkin 10/27 17:39, ,...","美麗線的黃醫師,找經驗豐富的醫生,直接給醫生,以去曼都給李院長",,台北
[問題] 台北眼袋手術建議診所及醫師已刪文,https://www.pttweb.cc/bbs/facelift/M.1697816579.A.3BF,,2023-10-20T23:42:00,[問題] 台北眼袋手術建議診所及醫師 - 看板facelift - PTT網頁版,術建議診所及醫師,台北眼袋手術建議診所,台北
[問題] 台北眼袋手術建議診所及醫師已刪文,https://www.pttweb.cc/bbs/facelift/M.1697816579.A.3BF,,2023-10-20T23:42:00,"[問題] 台北眼袋手術建議診所及醫師 已刪文 ＋收藏 分享 看板 facelift 作者 s0918831707 (Darcy) 時間 2年前 發表 (2023/10/20 23:42) , 編輯 推噓 1 ( 1 推 0 噓 0 → ) 留言 1則, 1人 參與 , 2年前 最新 討論串 1/1",術建議診所及醫師,台北眼袋手術建議診所,台北
[問題] 台北眼袋手術建議診所及醫師已刪文,https://www.pttweb.cc/bbs/facelift/M.1697816579.A.3BF,,2023-10-20T23:42:00,5. 極緻-？不知道找哪位醫師 好像關於眼袋的推薦也沒到很多,不知道找哪位醫師,,
[討論] 眼下細紋跟黑眼圈適合的醫美,https://www.pttweb.cc/bbs/facelift/M.1697783597.A.E07,,2023-10-20T14:33:00,[討論] 眼下細紋跟黑眼圈適合的醫美 - 看板facelift - PTT網頁版,,眼下細紋跟黑眼圈適合的醫美,
[討論] 眼下細紋跟黑眼圈適合的醫美,https://www.pttweb.cc/bbs/facelift/M.1697783597.A.E07,,2023-10-20T14:33:00,"[討論] 眼下細紋跟黑眼圈適合的醫美 ＋收藏 分享 看板 facelift 作者 a125701732 時間 2年前 發表 (2023/10/20 14:33) , 編輯 推噓 12 ( 12 推 0 噓 17 → ) 留言 29則, 13人 參與 , 2年前 最新 討論串 1/1",,眼下細紋跟黑眼圈適合的醫美,
[討論] 眼下細紋跟黑眼圈適合的醫美,https://www.pttweb.cc/bbs/facelift/M.1697783597.A.E07,,2023-10-20T14:33:00,", 18 F 補脂肪最有效，但醫師很重要不會補 10/21 18:18 , 18 F → emma08162000 10/21 18:18,",,,
[分享] 玻尿酸一次處理淚溝+眼袋，真是太滿意了已刪文,https://www.pttweb.cc/bbs/facelift/M.1697559758.A.D33,,2023-10-18T00:22:00,如題，應該是基因的遺傳還有生活習慣不好吧 我眼睛的老化問題滿明顯的 沒有去給醫生問過以前覺得自己是黑眼圈問題 所以以為靠打雷射可以處理 但是後來去了診所問過醫生 醫生直接點名我錯誤的觀念 他說我是眼袋型淚溝，所以才覺得黑眼圈很重,"沒有去給醫生,去了診所問過醫生",但是後來去了診所,
[分享] 玻尿酸一次處理淚溝+眼袋，真是太滿意了已刪文,https://www.pttweb.cc/bbs/facelift/M.1697559758.A.D33,,2023-10-18T00:22:00,當時醫生是說要處理的最到位就是要靠眼袋手術 但我本身有點怕動刀，又心裏沒準備本來只是要花一些錢變成一筆錢 在預算考量跟沒手術心理準備下就決定先聽醫生的次要方案就是打玻尿酸解決了,"當時醫生,下就決定先聽醫生",,
[分享] 玻尿酸一次處理淚溝+眼袋，真是太滿意了已刪文,https://www.pttweb.cc/bbs/facelift/M.1697559758.A.D33,,2023-10-18T00:22:00,打完當下其實有發現淚溝改善很多了 後續回去兩三天也都沒有瘀青，覺得醫生技術真的很好！！ 回家家人沒有發現我去做了什麼XD,覺得醫生,,
[分享] 玻尿酸一次處理淚溝+眼袋，真是太滿意了已刪文,https://www.pttweb.cc/bbs/facelift/M.1697559758.A.D33,,2023-10-18T00:22:00,不知道可以維持多久，緊緊張張 但真的很滿意現在的狀態所以上來分享給大家～～ 提醒大家玻尿酸打淚溝很吃醫生技術！一定要找好的不然會毛毛蟲喔～,酸打淚溝很吃醫生,,
[問題] 淚溝 玻尿酸 診所詢問,https://www.pttweb.cc/bbs/facelift/M.1697552808.A.F6A,,2023-10-17T22:26:00,[問題] 淚溝 玻尿酸 診所詢問 - 看板facelift - PTT網頁版,,[問題] 淚溝 玻尿酸 診所詢問 - 看板f,
[問題] 淚溝 玻尿酸 診所詢問,https://www.pttweb.cc/bbs/facelift/M.1697552808.A.F6A,,2023-10-17T22:26:00,"[問題] 淚溝 玻尿酸 診所詢問 ＋收藏 分享 看板 facelift 作者 yyunnai (ny) 時間 2年前 發表 (2023/10/17 22:26) , 2年前 編輯 推噓 7 ( 7 推 0 噓 17 → ) 留言 24則, 7人 參與 , 2年前 最新 討論串 1/1",,[問題] 淚溝 玻尿酸 診所詢問 ＋收藏 分,
[問題] 淚溝 玻尿酸 診所詢問,https://www.pttweb.cc/bbs/facelift/M.1697552808.A.F6A,,2023-10-17T22:26:00,2.佳思優 吳醫師 他們家有保柔提價格也還不錯，不過好像比較多看到的心得是打音波的 ，不知道有沒有人給他打過淚溝的心得？,,,
[問題] 淚溝 玻尿酸 診所詢問,https://www.pttweb.cc/bbs/facelift/M.1697552808.A.F6A,,2023-10-17T22:26:00,", 20 F 淚溝的位置很容易因爲醫師技術不好出現毛毛 10/25 18:30 , 20 F → rinne 10/25 18:31,",置很容易因爲醫師,,
[問題] 淚溝 玻尿酸 診所詢問,https://www.pttweb.cc/bbs/facelift/M.1697552808.A.F6A,,2023-10-17T22:26:00,", 23 F 綺給陳麒鈞醫生打淚溝(瑞絲朗)，他技術 10/25 18:45 , 23 F → boba2415 10/25 18:45,",綺給陳麒鈞醫生,,
[討論] 眼袋+割雙眼皮+開眼頭可以一起做嗎,https://www.pttweb.cc/bbs/facelift/M.1696998369.A.FEA,,2023-10-11T12:26:00,", 4 F 眼袋補淚溝 看醫生吧 有些醫生只擅長割 10/11 14:48 , 4 F → Preesent 10/11 14:48,",有些醫生,,
[討論] 眼袋+割雙眼皮+開眼頭可以一起做嗎,https://www.pttweb.cc/bbs/facelift/M.1696998369.A.FEA,,2023-10-11T12:26:00,", 17 F 可以，一次解決 10/12 19:22 , 17 F → cawaiimaple 10/15 00:38, , 18 F 眼距要看比例吧，原po可能臉小？前陣 10/15 00:38 , 18 F → cawaiimaple 10/15 00:38, , 19 F 子才看某日本整形醫生影片說平均是37 10/15 00:38 , 19 F → cawaiimaple 10/15 00:38, , 20 F mm哩 10/15 00:38 , 20 F 推 pony2129 10/17 16:10, ,...","看某日本整形醫生,問看看蔡宗賢醫師,給君綺的王醫師",,
[問題] 眼袋外開手術傷口多久復原,https://www.pttweb.cc/bbs/facelift/M.1696996519.A.3BF,,2023-10-11T11:55:00,之前就蠻想做眼袋手術的 前幾天爬文發現年紀大的人適合做眼袋外開 可以把細紋一起處理掉 但傷口恢復的時間比較長 我比較擔心傷口很大 沒辦法見人 還有手術完 眼袋會不會很快就復原 想問做過的人 傷口大概多久復原 手術做完維持多久 有推的醫生嗎,有推的醫生,,
[問題] 眼袋外開手術傷口多久復原,https://www.pttweb.cc/bbs/facelift/M.1696996519.A.3BF,,2023-10-11T11:55:00,", 4 F 我奔四 但醫生建議我做內開眼袋+外側修 10/11 15:51 , 4 F → Inatical 10/11 15:51,",,,
[問題] 眼袋外開手術傷口多久復原,https://www.pttweb.cc/bbs/facelift/M.1696996519.A.3BF,,2023-10-11T11:55:00,", 5 F 皮 傷口比外開小很多 我做完六年了 10/11 15:51 , 5 F 原來可以內開 請益樓上傷口多久復原 給哪一位醫生做的 還想問你是舒麻還局麻 因為我還在猶豫",給哪一位醫生,,
[問題] 眼袋外開手術傷口多久復原,https://www.pttweb.cc/bbs/facelift/M.1696996519.A.3BF,,2023-10-11T11:55:00,", 12 F 醫師 10/12 15:53 , 12 F 推 devil8411 10/17 23:29, , 13 F 外開的話恢復期長一點點，建議抓兩週 10/17 23:29 , 13 F → devil8411 10/17 23:29, , 14 F ～但我自己做內開，恢復期很短，大概 10/17 23:29 , 14 F → devil8411 10/17 23:29, , 15 F 一週內就沒什麼瘀青可以見人了，我給 10/17 23:29 , 15 F → devil8411 10/17 23:29,...",,,
[討論] 有人內開眼袋下眼瞼外翻的嗎..,https://www.pttweb.cc/bbs/facelift/M.1696925647.A.B5F,,2023-10-10T16:14:00,目前手術完第11天 很明顯下眼瞼看起來比過去外露（微外翻的感覺？） 眼神也變了 雖然詢問過診所 診所表示還在恢復期,,雖然詢問過診所,
[分享] 終於跟淚溝眼袋分手了,https://www.pttweb.cc/bbs/facelift/M.1696854792.A.09D,,2023-10-09T20:33:00,"這次做的是""眼袋脂肪移位填補淚溝"" (沒另外補脂) 含抽血檢驗費用、術後護理包、舒眠麻醉 #花費45k有找 #陳o良整型外科診所 基於取之於網路 回饋於網路 自己的親身體驗 分享給有需要的鄉民",,陳o良整型外科診所,
[問題] 眼袋雙眼皮 北部醫師推薦 內有選手,https://www.pttweb.cc/bbs/facelift/M.1696721273.A.65A,,2023-10-08T07:27:00,[問題] 眼袋雙眼皮 北部醫師推薦 內有選手 - 看板facelift - PTT網頁版,北部醫師,,
[問題] 眼袋雙眼皮 北部醫師推薦 內有選手,https://www.pttweb.cc/bbs/facelift/M.1696721273.A.65A,,2023-10-08T07:27:00,"[問題] 眼袋雙眼皮 北部醫師推薦 內有選手 ＋收藏 分享 看板 facelift 作者 jenny0527945 (楊喰雅子) 時間 2年前 發表 (2023/10/08 07:27) , 2年前 編輯 推噓 5 ( 5 推 0 噓 2 → ) 留言 7則, 5人 參與 , 最新 討論串 1/1",北部醫師,,
[問題] 眼袋雙眼皮 北部醫師推薦 內有選手,https://www.pttweb.cc/bbs/facelift/M.1696721273.A.65A,,2023-10-08T07:27:00,大家好！ 想一次處理割眼袋跟縫雙眼皮 爬文看到都是分別推薦的醫師 不知道有沒有兩者兼推的醫師 選手分別為～,"是分別推薦的醫師,有兩者兼推的醫師",,
[問題] 台北眼袋醫生推薦~,https://www.pttweb.cc/bbs/facelift/M.1695701510.A.690,,2023-09-26T12:11:00,[問題] 台北眼袋醫生推薦~ - 看板facelift - PTT網頁版,台北眼袋醫生,,台北
[問題] 台北眼袋醫生推薦~,https://www.pttweb.cc/bbs/facelift/M.1695701510.A.690,,2023-09-26T12:11:00,"[問題] 台北眼袋醫生推薦~ ＋收藏 分享 看板 facelift 作者 childruby (迷漾D) 時間 2年前 發表 (2023/09/26 12:11) , 編輯 推噓 11 ( 11 推 0 噓 18 → ) 留言 29則, 13人 參與 , 最新 討論串 1/1",台北眼袋醫生,,台北
[問題] 台北眼袋醫生推薦~,https://www.pttweb.cc/bbs/facelift/M.1695701510.A.690,,2023-09-26T12:11:00,版上有很多眼袋內開的醫生推薦文 但我偏好外開或是複合式的 不太想純內開式是因為怕之後還要回去填補眼部脂肪 想問問台北有沒有推薦的眼袋醫生或是診所做外開/複合式眼袋比較厲害的？謝謝,"多眼袋內開的醫生,有推薦的眼袋醫生",想問問台北有沒有推薦的眼袋醫生或是診所,台北
[問題] 台北眼袋醫生推薦~,https://www.pttweb.cc/bbs/facelift/M.1695701510.A.690,,2023-09-26T12:11:00,", 10 F 群英洪章桂醫生，認識的姐姐給他做眼袋 09/27 16:10 , 10 F → baomei520 09/27 16:10,",群英洪章桂醫生,,
[問題] 台北眼袋醫生推薦~,https://www.pttweb.cc/bbs/facelift/M.1695701510.A.690,,2023-09-26T12:11:00,", 19 F 我也想做眼袋手術！但諮詢一輪下來醫生 09/28 12:08 , 19 F → patootoo 09/28 12:08,",諮詢一輪下來醫生,,
[問題] 台北眼袋醫生推薦~,https://www.pttweb.cc/bbs/facelift/M.1695701510.A.690,,2023-09-26T12:11:00,", 23 F 我是給余德毅醫生做的，他內開外開都有做 09/28 18:35 , 23 F → Xd85ny 09/28 18:36,",我是給余德毅醫生,,
[問題] 台北眼袋醫生推薦~,https://www.pttweb.cc/bbs/facelift/M.1695701510.A.690,,2023-09-26T12:11:00,", 25 F 慕顏周杰醫生，不過他是內開+修皮，不做 09/29 07:48 , 25 F → kllara 09/29 07:48,",慕顏周杰醫生,,
[問題] 眼袋手術醫師建議推薦,https://www.pttweb.cc/bbs/facelift/M.1694397860.A.539,,2023-09-11T10:04:00,[問題] 眼袋手術醫師建議推薦 - 看板facelift - PTT網頁版,眼袋手術醫師,,
[問題] 眼袋手術醫師建議推薦,https://www.pttweb.cc/bbs/facelift/M.1694397860.A.539,,2023-09-11T10:04:00,"[問題] 眼袋手術醫師建議推薦 ＋收藏 分享 看板 facelift 作者 skytanosii (hapi : )) 時間 2年前 發表 (2023/09/11 10:04) , 編輯 推噓 1 ( 1 推 0 噓 5 → ) 留言 6則, 3人 參與 , 2年前 最新 討論串 1/1",眼袋手術醫師,,
[問題] 眼袋手術醫師建議推薦,https://www.pttweb.cc/bbs/facelift/M.1694397860.A.539,,2023-09-11T10:04:00,這是友人有去做微整推薦的診所 整體都還行，但是感覺在很昏暗的地方觀看不知道到底這樣看眼袋是不是夠準確...,,這是友人有去做微整推薦的診所,
[問題] 台北眼袋手術推薦診所與術後恢復,https://www.pttweb.cc/bbs/facelift/M.1693985291.A.22C,,2023-09-06T15:28:00,[問題] 台北眼袋手術推薦診所與術後恢復 - 看板facelift - PTT網頁版,,台北眼袋手術推薦診所,台北
[問題] 台北眼袋手術推薦診所與術後恢復,https://www.pttweb.cc/bbs/facelift/M.1693985291.A.22C,,2023-09-06T15:28:00,"[問題] 台北眼袋手術推薦診所與術後恢復 ＋收藏 分享 看板 facelift 作者 ifeelgood8 (sugar110203) 時間 2年前 發表 (2023/09/06 15:28) , 編輯 推噓 2 ( 2 推 0 噓 7 → ) 留言 9則, 3人 參與 , 2年前 最新 討論串 1/1",,台北眼袋手術推薦診所,台北
[問題] 台北眼袋手術推薦診所與術後恢復,https://www.pttweb.cc/bbs/facelift/M.1693985291.A.22C,,2023-09-06T15:28:00,", 6 F 我是給晶美陳院長做內開眼袋，因為 09/07 21:27 , 6 F → peipeiishere 09/07 21:27,",我是給晶美陳院長,,
[問題] 台北眼袋手術推薦診所與術後恢復,https://www.pttweb.cc/bbs/facelift/M.1693985291.A.22C,,2023-09-06T15:28:00,", 7 F 我淚溝也滿嚴重的，醫師有推薦我用 09/07 21:27 , 7 F → peipeiishere 09/07 21:28,",,,
[心得] 台中割眼袋眼皮取脂（雙眼皮）,https://www.pttweb.cc/bbs/facelift/M.1693962787.A.3A2,,2023-09-06T09:13:00,過一個月後我發現笑起來感覺眼袋又跑除來，當下心情真的有點差，於是問了診所，診 所回覆在等幾個月看看，應該還在恢復期。,,於是問了診所,
[心得] 台中割眼袋眼皮取脂（雙眼皮）,https://www.pttweb.cc/bbs/facelift/M.1693962787.A.3A2,,2023-09-06T09:13:00,過了幾個月後真的有比較消，所以在第一個月時真的還是有點腫， 期間診所只有在回來的第一天有關心過，整個復原修復期間完全沒關心過，這一點真的真 的蠻不ok的。 時間一天一天過去在第2個月時發現我的淚溝好明顯，心裡想說會不會再等一個月就好了 （看案例大約都3個月差不多就穩定了）,,期間診所,
[心得] 台中割眼袋眼皮取脂（雙眼皮）,https://www.pttweb.cc/bbs/facelift/M.1693962787.A.3A2,,2023-09-06T09:13:00,來到第3個月回診，我跟醫生說淚溝很明顯還有左眼的部分眼袋好像還有一點，醫生回覆 說這個打一些坡尿酸就好或者補脂，整個時間不到5分鐘就結束了，然後接下來說明做這 個又要多少錢，當然也是不便宜。 在回診前其實我心裡早就有底了，也沒跟診所吵什麼，也沒什麼所謂的糾紛，分享這個過 程是想讓大家要做這個手術的人可以多一點資訊，現在修圖容易，買廣告容易，這次經驗 感覺就是收了錢做完之後就不管，蠻現實的，慶幸沒有發生手術把我弄壞掉之類的，期間 也很謝謝桃園某知名醫師（我弟女友在那邊做雙眼皮介紹給我的）在IG上會跟我說一些問 題，雖...,"我跟醫生,謝桃園某知名醫師",也沒跟診所,桃園
[問題] 眼袋內開+補脂 失敗？？,https://www.pttweb.cc/bbs/facelift/M.1693331483.A.1B1,,2023-08-30T01:51:00,我現在很焦慮 該不會是醫生補錯地方吧！怎麼會補脂補在眼袋？！,該不會是醫生,,
[問題] 眼袋內開+補脂 失敗？？,https://www.pttweb.cc/bbs/facelift/M.1693331483.A.1B1,,2023-08-30T01:51:00,", 12 F 醫生都會多補脂肪，我媽三個月才吸收到 08/31 10:42 , 12 F → mickeygo 08/31 10:42,",,,
[心得] 擺脫濾鏡的眼袋內開+淚溝補脂心得,https://www.pttweb.cc/bbs/facelift/M.1692973773.A.3EB,,2023-08-25T22:29:00,這中間也開始做了很多功課， 眼袋方面是必須動手術拿掉沒什麼問題， 淚溝的部分由於之前身邊聽到看過太多玻尿酸不成功的例子， 加上最終也會被人體吸收，可能每半年就要補一次， 於材質，時間，金錢成本考量都覺得不適合自己，因此不考慮。 諮詢過後醫師建議眼袋內開+抽肚子的脂肪補淚溝跟蘋果肌。,諮詢過後醫師,,
[心得] 擺脫濾鏡的眼袋內開+淚溝補脂心得,https://www.pttweb.cc/bbs/facelift/M.1692973773.A.3EB,,2023-08-25T22:29:00,這幾天比較忙，終於在剛剛一一把大家的私訊回完。也很謝謝大家的推文。我是給板橋尚水 美博的詹院長開的。當初也是做了很多功課比了很多家。只能說很慶幸自己的選擇。也祝福 大家早日擺脫眼袋這個煩人的小包袱！,美博的詹院長,,
擺脫濾鏡人生的眼袋內開跟淚溝填補已刪文,https://www.pttweb.cc/bbs/facelift/M.1692951892.A.057,,2023-08-25T16:24:00,這中間也開始做了很多功課， 眼袋方面是必須動手術拿掉沒什麼問題， 淚溝的部分由於之前身邊聽到看過太多玻尿酸不成功的例子， 加上最終也會被人體吸收，可能每半年就要補一次， 於材質，時間，金錢成本考量都覺得不適合自己，因此不考慮。 諮詢過後醫師建議眼袋內開+抽肚子的脂肪補淚溝跟蘋果肌。,諮詢過後醫師,,
[心得] 眼袋內開一個月，妝容終於乾淨了,https://www.pttweb.cc/bbs/facelift/M.1692788361.A.F17,,2023-08-23T18:59:00,因為今年有了某個目標後，終於讓我下定決心在出國前處理那討人厭的眼袋，諮詢了幾間 診所都是建議內開眼袋+自體脂肪補淚溝、蘋果肌,,人厭的眼袋，諮詢了幾間 診所都是建議內開眼袋,
[心得] 眼袋內開一個月，妝容終於乾淨了,https://www.pttweb.cc/bbs/facelift/M.1692788361.A.F17,,2023-08-23T18:59:00,", 8 F 恭喜～你的眼袋狀況和我好像 想問醫生價 08/23 21:55 , 8 F 推 noteflower92 08/23 22:08,",想問醫生,,
[問題] 眼袋手術會順便做補脂嗎,https://www.pttweb.cc/bbs/facelift/M.1692672374.A.5D4,,2023-08-22T10:46:00,本身眼袋問題就滿嚴重又有一點黑眼圈 目前是有考慮找台中的診所做眼袋手術 諮詢三間有兩間叫我考慮可以和蘋果肌補脂一起做臉型線條會更好,,目前是有考慮找台中的診所,台中
[問題] 眼袋手術會順便做補脂嗎,https://www.pttweb.cc/bbs/facelift/M.1692672374.A.5D4,,2023-08-22T10:46:00,", 5 F 說要補脂又要跑一次診所 08/22 12:13 , 5 F 推 BFONE 08/22 13:07,",,說要補脂又要跑一次診所,
[分享] 台北內開眼袋手術一年後心得,https://www.pttweb.cc/bbs/facelift/M.1692251416.A.5E9,,2023-08-17T13:50:00,後來跟另一半討論完，我就決定要在婚禮前做好手術，於是開始諮詢眼袋手術。第一間諮 詢，醫師點出我除了要做眼袋手術外，還建議我要抽脂補臉，因為臉比較凹一點，一起做 效果比較好。我聽到很緊張，因為如果還要補脂的話，臉上可能會有一些瘀血，而我又是 容易瘀血又復原很慢的人。第二間諮詢，醫師說我的臉其實沒有很凹，不需要到抽脂補臉 ，眼袋的話，做眼袋內開脂肪移位填補淚溝其實就可以了，如果做完還是覺得整體有疲倦 感，再來評估看要怎麼調整。因為我很擔心恢復期的問題，加上我覺得自己的臉似乎沒有 到一定要補脂，比較棘手的是眼袋的問題，所...,,所以想說先在第二間診所,
[分享] 台北內開眼袋手術一年後心得,https://www.pttweb.cc/bbs/facelift/M.1692251416.A.5E9,,2023-08-17T13:50:00,因為我本身是比較不容易緊張的人，所以眼袋手術我是選擇局部麻醉，醫師原本還問我要 不要加鎮定止痛點滴，我說我是女漢子我不怕哈！很特別的是手術全程我都醒著，都知道 醫生在幹嘛，護理人員也是一直有在旁邊幫我加油打氣，讓我比較安心一點！然後手術真 的不怎麼痛耶，手術也大概一個小時內就結束了。,,,
[分享] 台北內開眼袋手術一年後心得,https://www.pttweb.cc/bbs/facelift/M.1692251416.A.5E9,,2023-08-17T13:50:00,", 22 F 最近也在研究眼袋手術 想了解診所跟醫生 08/18 23:56 , 22 F → a1552028 08/18 23:57,",想了解診所跟醫生,想了解診所,
[問題] 不想再遮眼袋 求推薦眼袋手術醫生,https://www.pttweb.cc/bbs/facelift/M.1692081312.A.780,,2023-08-15T14:35:00,[問題] 不想再遮眼袋 求推薦眼袋手術醫生 - 看板facelift - PTT網頁版,推薦眼袋手術醫生,,
[問題] 不想再遮眼袋 求推薦眼袋手術醫生,https://www.pttweb.cc/bbs/facelift/M.1692081312.A.780,,2023-08-15T14:35:00,"[問題] 不想再遮眼袋 求推薦眼袋手術醫生 ＋收藏 分享 看板 facelift 作者 Lanticil (Lanticil) 時間 2年前 發表 (2023/08/15 14:35) , 2年前 編輯 推噓 15 ( 15 推 0 噓 17 → ) 留言 32則, 16人 參與 , 最新 討論串 1/1",推薦眼袋手術醫生,,
[問題] 不想再遮眼袋 求推薦眼袋手術醫生,https://www.pttweb.cc/bbs/facelift/M.1692081312.A.780,,2023-08-15T14:35:00,大家我想問 我的眼袋很明顯 明明很年輕 可是照鏡子都覺得自己老起來放 化妝都一定要用遮瑕膏 出社會之後 自己有存了一些錢 如果要動刀好像也不是不行......... 只是＠＠我還是有點猶豫 也有想過要打玻尿酸 可是要一直補打有點麻煩 眼袋手術比較能直接解決問題 大家有推薦的醫生嗎 我想先去問問看 還有一點很怕就是打麻醉 會很痛嗎@@,大家有推薦的醫生,,
[問題] 不想再遮眼袋 求推薦眼袋手術醫生,https://www.pttweb.cc/bbs/facelift/M.1692081312.A.780,,2023-08-15T14:35:00,", 14 F 眼袋手術做完會後悔怎麼沒早點做XD 08/16 16:58 , 14 F 謝謝大家給的建議！ 我先去預約看看錢醫生好了",去預約看看錢醫生,,
