thread_title,thread_url,thread_author,thread_datetime,snippet,doctors,clinics,city
[問題] 台北診所推薦(眼袋手術及黑眼圈改善),https://www.pttweb.cc/bbs/facelift/M.1731901954.A.125,,2024-11-18T11:52:00,", 34 F 給黃仁吳醫師開有回填淚溝，填平之後 11/24 21:18 , 34 F → sandrahuang 11/24 21:18,",給黃仁吳醫師,,
[問題] 台北診所推薦(眼袋手術及黑眼圈改善),https://www.pttweb.cc/bbs/facelift/M.1731901954.A.125,,2024-11-18T11:52:00,", 36 F 我找鍾立人醫師做內開眼袋手術後，眼 11/26 14:59 , 36 F → crouhselang 11/26 15:00,",我找鍾立人醫師,,
[問題] 台北眼袋醫生選手,https://www.pttweb.cc/bbs/facelift/M.1731636764.A.946,,2024-11-15T10:12:00,[問題] 台北眼袋醫生選手 - 看板facelift - PTT網頁版,台北眼袋醫生,,台北
[問題] 台北眼袋醫生選手,https://www.pttweb.cc/bbs/facelift/M.1731636764.A.946,,2024-11-15T10:12:00,"[問題] 台北眼袋醫生選手 ＋收藏 分享 看板 facelift 作者 abckitty (比特熊金貝貝) 時間 1年前 發表 (2024/11/15 10:12) , 編輯 推噓 3 ( 3 推 0 噓 10 → ) 留言 13則, 4人 參與 , 1年前 最新 討論串 1/1",台北眼袋醫生,,台北
[問題] 台北眼袋醫生選手,https://www.pttweb.cc/bbs/facelift/M.1731636764.A.946,,2024-11-15T10:12:00,大家好， 我想做眼袋內開手術， 目前諮詢了兩家， 1.凡登 馮院長 2.晶華 鄭院長 還沒諮詢的是如一 蕭醫生,,,
[問題] 台北眼袋醫生選手,https://www.pttweb.cc/bbs/facelift/M.1731636764.A.946,,2024-11-15T10:12:00,我打算眼袋脂肪轉位淚溝， 沒有要聽醫生建議補蘋果肌， 一方面覺得貴， 一方面覺得動越少越好。,沒有要聽醫生,,
[問題] 台北眼袋醫生選手,https://www.pttweb.cc/bbs/facelift/M.1731636764.A.946,,2024-11-15T10:12:00,", 1 F 上個月給蕭醫生做眼袋轉淚溝滿意，但小 11/17 23:01 , 1 F → lee1406 11/17 23:01,",上個月給蕭醫生,,
[問題] 有擅長開眼袋轉位手術的醫師嗎?,https://www.pttweb.cc/bbs/facelift/M.1731297598.A.600,,2024-11-11T11:59:00,[問題] 有擅長開眼袋轉位手術的醫師嗎? - 看板facelift - PTT網頁版,袋轉位手術的醫師,,
[問題] 有擅長開眼袋轉位手術的醫師嗎?,https://www.pttweb.cc/bbs/facelift/M.1731297598.A.600,,2024-11-11T11:59:00,"[問題] 有擅長開眼袋轉位手術的醫師嗎? ＋收藏 分享 看板 facelift 作者 Cavaliers02 (S/O雷霸龍) 時間 1年前 發表 (2024/11/11 11:59) , 1年前 編輯 推噓 6 ( 6 推 0 噓 9 → ) 留言 15則, 6人 參與 , 1年前 最新 討論串 1/1",袋轉位手術的醫師,,
[問題] 有擅長開眼袋轉位手術的醫師嗎?,https://www.pttweb.cc/bbs/facelift/M.1731297598.A.600,,2024-11-11T11:59:00,原本以為眼袋手術不算是個大手術 想直接找家評價不錯的大診所諮詢 結果被老婆阻止，說是要動刀的手術怎麼能馬虎 又不是去挖肉瘤、除痣那種的,,想直接找家評價不錯的大診所,
[問題] 有擅長開眼袋轉位手術的醫師嗎?,https://www.pttweb.cc/bbs/facelift/M.1731297598.A.600,,2024-11-11T11:59:00,因為我眼袋是真的蠻明顯 但看到有些人處理完眼袋後，反而覺得眼下凹陷感變重？ 感覺這得靠醫師的經驗美感去評估 所以想問問大家術後心得？覺得眼袋手術值得嗎？,感覺這得靠醫師,,
[問題] 有擅長開眼袋轉位手術的醫師嗎?,https://www.pttweb.cc/bbs/facelift/M.1731297598.A.600,,2024-11-11T11:59:00,", 6 F 轉位後如果脂肪不夠用還是要補脂 11/12 10:05 , 6 F 了解，但如果有經驗的醫師是可以先判斷夠不夠用嗎？",如果有經驗的醫師,,
[問題] 有擅長開眼袋轉位手術的醫師嗎?,https://www.pttweb.cc/bbs/facelift/M.1731297598.A.600,,2024-11-11T11:59:00,", 9 F 黑眼圈暗沉或貓咪紋問題比較有關 11/12 14:20 , 9 F 好的，後來被老婆提醒自己也是細細觀察臉部狀態 有可能不只是眼袋問題讓我看起來顯老版上我看幾篇是內開＋補淚溝 好像有看到台北一家花漾國際錢醫師是做眼袋轉位 但網路上案例不多，感覺沒有特別打廣告",家花漾國際錢醫師,,台北
[問題] 新竹眼袋推薦醫師,https://www.pttweb.cc/bbs/facelift/M.1731165377.A.92F,,2024-11-09T23:16:00,[問題] 新竹眼袋推薦醫師 - 看板facelift - PTT網頁版,新竹眼袋推薦醫師,,新竹
[問題] 新竹眼袋推薦醫師,https://www.pttweb.cc/bbs/facelift/M.1731165377.A.92F,,2024-11-09T23:16:00,"[問題] 新竹眼袋推薦醫師 ＋收藏 分享 看板 facelift 作者 m13236 (m13236) 時間 1年前 發表 (2024/11/09 23:16) , 1年前 編輯 推噓 2 ( 2 推 0 噓 0 → ) 留言 2則, 2人 參與 , 1年前 最新 討論串 1/1",新竹眼袋推薦醫師,,新竹
[問題] 新竹眼袋推薦醫師,https://www.pttweb.cc/bbs/facelift/M.1731165377.A.92F,,2024-11-09T23:16:00,", 2 F 家人有去給馮醫師做眼袋，很推薦！ 11/13 00:20 , 2 F ‣ 返回看板 [ facelift ] 美容 ‣ 更多 m13236 的文章 文章代碼(AID): #1dBtp1al (facelift) 更多分享選項 網址： 短網址： 文章代碼(AID)：",家人有去給馮醫師,,
[問題] 眼袋凹凸不平想做眼袋手術求解惑,https://www.pttweb.cc/bbs/facelift/M.1731060270.A.90B,,2024-11-08T18:04:00,想問眼袋凹凸不平是可以靠眼袋手術解決的嗎? 我眼袋看著不深 但凹凸不平滿明顯 如果有黑眼圈做完手術會更明顯嗎? 我黑眼圈有深有淺覺得用遮瑕好難遮 怕手術完會因為沒有眼袋會更明顯? (補充 我都還沒去問過醫生 想說先來看看有沒有人有經驗),都還沒去問過醫生,,
[分享] 終於做內開眼袋了,https://www.pttweb.cc/bbs/facelift/M.1730897978.A.EDF,,2024-11-06T20:59:00,我的眼袋一直都很明顯，再加上黑眼圈很深， 所以很常被問我是不是沒睡飽，難聽一點的會笑我很老或者問我是不是有在吸@@但我又偏俗 辣， 所以一直都沒下定決心， 剛好前陣子朋友做了內開，看他恢復得很好， 術後照顧感覺也很簡單， 所以我去找他的醫生諮詢後， 就直接把我的眼袋基金拿出來衝了,以我去找他的醫生,,
[分享] 終於做內開眼袋了,https://www.pttweb.cc/bbs/facelift/M.1730897978.A.EDF,,2024-11-06T20:59:00,個人覺得我的眼下皮膚也有點鬆， 所以我原本有點怕要做外開，諮詢後醫生說做內開就行了，保險起見我有再諮詢了2間， 其他醫生也都建議我做內開， 綜合評估交通跟術後案例，我還是回到第1間開了 術前醫生就有先跟我說可能會有眼睛血腫或瘀青的問題，建議我至少要完全休養3-5天， 但術後我猛冰敷再加上蜈蚣草水， 我基本上都沒有腫跟瘀青， 大概快1個月就完全消腫了，朋友說我是比較快的，他自己大約1個半月才完全消,"諮詢後醫生,其他醫生,術前醫生",,
[問題] 中年眼袋外開適合嗎？,https://www.pttweb.cc/bbs/facelift/M.1730864186.A.73A,,2024-11-06T11:36:00,現在也漸漸邁入中年 最近覺得臉變老態，看起來也沒啥精神 除了眼袋外，還有淚溝跟眼尾的皺紋 大概半年前有去傑尼斯診所問過眼袋手術 當時潘醫師推薦可做眼袋外開 猶豫思考後就擺著也沒做... 最近覺得不太行，所以下決心想做手術 下周還要去另一家診所諮詢 想多方比較一下 請問有人在傑尼斯診所做過眼袋手術的嗎？ 年紀大適合開眼袋嗎？ 謝謝大家,當時潘醫師,"大概半年前有去傑尼斯診所,下周還要去另一家診所,請問有人在傑尼斯診所",
[問題] 眼袋醫師詢問,https://www.pttweb.cc/bbs/facelift/M.1730294523.A.CB7,,2024-10-30T21:22:00,[問題] 眼袋醫師詢問 - 看板facelift - PTT網頁版,眼袋醫師,,
[問題] 眼袋醫師詢問,https://www.pttweb.cc/bbs/facelift/M.1730294523.A.CB7,,2024-10-30T21:22:00,"[問題] 眼袋醫師詢問 ＋收藏 分享 看板 facelift 作者 eva7989 (eva) 時間 1年前 發表 (2024/10/30 21:22) , 1年前 編輯 推噓 5 ( 5 推 0 噓 5 → ) 留言 10則, 5人 參與 , 1年前 最新 討論串 1/1",眼袋醫師,,
[問題] 眼袋醫師詢問,https://www.pttweb.cc/bbs/facelift/M.1730294523.A.CB7,,2024-10-30T21:22:00,最近想要去做眼袋內開處理淚溝的部分～目前找了三家診所，只有先約到花漾諮詢，想問 以下這三位醫師哪位推薦呢？另外，也想問看看眼袋補脂跟轉位那種比較好,以下這三位醫師,目前找了三家診所,
[問題] 眼袋醫師詢問,https://www.pttweb.cc/bbs/facelift/M.1730294523.A.CB7,,2024-10-30T21:22:00,1.花漾 錢逸群醫師 ，用眼袋轉位的方式 2.璞美 荊偉政醫師，還沒諮詢過不知道細節 3.巨星 林敬鈞醫師 ，還沒諮詢不過爬文似乎是用補脂的方式,"錢逸群醫師,荊偉政醫師,林敬鈞醫師",,
[問題] 眼袋醫師詢問,https://www.pttweb.cc/bbs/facelift/M.1730294523.A.CB7,,2024-10-30T21:22:00,", 5 F me：群英 林雍球醫師 外開轉位加拉 11/04 18:23 , 5 F → babybabychun 11/04 18:24,",林雍球醫師,,
[問題] 眼袋醫師詢問,https://www.pttweb.cc/bbs/facelift/M.1730294523.A.CB7,,2024-10-30T21:22:00,", 7 F 之前去濰視美學給院長諮詢 他是用內開+玻 11/05 09:27 , 7 F → spcule 11/05 09:27,",去濰視美學給院長,,
[問題] 眼袋醫師詢問,https://www.pttweb.cc/bbs/facelift/M.1730294523.A.CB7,,2024-10-30T21:22:00,", 9 F 我妹是找如一蕭奕君醫師做內開 方式是眼袋 11/07 17:19 , 9 F → tszz 11/07 17:20,",找如一蕭奕君醫師,,
問題 請問需要開眼袋嗎？,https://www.pttweb.cc/bbs/facelift/M.1730271680.A.C78,,2024-10-30T15:01:00,最近覺得眼睛總是有種疲憊感 感覺眼袋好像有點明顯 已經詢問過幾家診所 都是建議要開(儷人、花漾、尚水美博) 平常都是戴眼鏡 也沒有化妝習慣 出去玩才會戴隱形眼鏡 一年加起來應該不到30天,,已經詢問過幾家診所,
[分享] 做完眼袋手術，終於讓我看起來像自己的年,https://www.pttweb.cc/bbs/facelift/M.1729393871.A.E9E,,2024-10-20T11:11:00,出社會後也有嘗試過玻尿酸或眼周填補之類的微整，但持續時間很短，大約一年就開始不見 了，而且只能補淚溝 眼袋的部分是無法解決的 因為也厭煩了每次填填補補這樣子的困擾，所以便開始查詢眼袋手術 後來知道有這種眼袋內開+補自體脂肪的方案後，就決定在奔三之前把這個困擾我多年的問? 解決。 諮詢過程醫師有問必答，讓我非常安心，決定在這邊做內開+補淚溝&蘋果肌。 跟自己的眼袋告別，也在診所留下了最醜的照片 自己看了真實的照片，還真像個欠卡債幾千萬的臉，而且眼袋跟我的長相 常常都被誤認成三四十歲的樣子= = 只能說天生長得成熟的人...,諮詢過程醫師,也在診所,
[分享] 做完眼袋手術，終於讓我看起來像自己的年,https://www.pttweb.cc/bbs/facelift/M.1729393871.A.E9E,,2024-10-20T11:11:00,畢竟是第一次選擇動刀，很怕自己會有心理壓力所以選擇了全麻 至少可以好好睡了一覺，然後再被護理師叫醒後就完成了 手術時間也不長，我甚至還想多睡一點>< 醒來後護理師還給我看了我眼袋裡面拿出來的脂肪 而且不用在眼下貼透氣膠帶，只需要貼人工皮在補脂的傷口就好，這也是為什麼我選擇這一 家診所的原因，太多家診所都說做完要貼三天左右 但，手術完當天真的很種很醜，請原諒我不提供會嚇到大家的照片(如果有超過50位網友要? ，我再放XDXD),,太多家診所,
[分享] 做完眼袋手術，終於讓我看起來像自己的年,https://www.pttweb.cc/bbs/facelift/M.1729393871.A.E9E,,2024-10-20T11:11:00,前一個月脂肪比較腫且硬，醫師表示是正常的，一個月後會慢慢軟化，確實大約一個月開始 硬腫的感覺慢慢退去，三個月的時候完全恢復正常的觸感，補脂的效果也非常好。 不過我還是有黑眼圈問題，但這個好像是靠眼袋手術也無法解決 問過滿多家都說這是體質關係，或建議我用威萃之類的 但拿掉眼袋的脂肪後，其實氣色就差很多了 雖然沒有變成少女樣，但感覺比較像我的年紀了(感動得想哭),,,
[分享] 做完眼袋手術，終於讓我看起來像自己的年,https://www.pttweb.cc/bbs/facelift/M.1729393871.A.E9E,,2024-10-20T11:11:00,", 13 F 我也是這種顏色的黑眼圈！求醫生價錢～ 10/24 00:17 , 13 F → vicky0516 10/24 13:02,",,,
[分享] 做完眼袋手術，終於讓我看起來像自己的年,https://www.pttweb.cc/bbs/facelift/M.1729393871.A.E9E,,2024-10-20T11:11:00,", 22 F 想知道診所/醫生/費用, 謝謝! 10/28 16:31 , 22 F 回應大家，我超推我的眼袋醫生 溫柔又細心，最重要的當然是幫我變年輕！醫生是詹東峻，在板橋尚水博做內開跟補淚溝蘋 果肌脂肪，睡著做手術，手術約7萬多快8",超推我的眼袋醫生,想知道診所,
[問題] 新竹打淚溝玻尿酸的診所(或醫師),https://www.pttweb.cc/bbs/facelift/M.1729235727.A.7BC,,2024-10-18T15:15:00,[問題] 新竹打淚溝玻尿酸的診所(或醫師) - 看板facelift - PTT網頁版,,新竹打淚溝玻尿酸的診所,新竹
[問題] 新竹打淚溝玻尿酸的診所(或醫師),https://www.pttweb.cc/bbs/facelift/M.1729235727.A.7BC,,2024-10-18T15:15:00,"[問題] 新竹打淚溝玻尿酸的診所(或醫師) ＋收藏 分享 看板 facelift 作者 hinetcsw (YOGA55155) 時間 1年前 發表 (2024/10/18 15:15) , 編輯 推噓 6 ( 6 推 0 噓 12 → ) 留言 18則, 6人 參與 , 1年前 最新 討論串 1/1",,新竹打淚溝玻尿酸的診所,新竹
[問題] 新竹打淚溝玻尿酸的診所(或醫師),https://www.pttweb.cc/bbs/facelift/M.1729235727.A.7BC,,2024-10-18T15:15:00,一直以為最近出現在我眼下陰影是黑眼圈 仔細看才發現是淚溝 爬文看滿多人淚溝會打玻尿酸 但淚溝好像很看醫師技術，看到有些失敗腫起來的 想問新竹有沒有技術好一點的診所或醫師 還有淚溝是不是打喬雅登或瑞絲朗這兩牌比較保險？,"淚溝好像很看醫師,一點的診所或醫師",想問新竹有沒有技術好一點的診所,新竹
[問題] 新竹打淚溝玻尿酸的診所(或醫師),https://www.pttweb.cc/bbs/facelift/M.1729235727.A.7BC,,2024-10-18T15:15:00,", 1 F 淚溝的確很吃醫生技術，有預算的話就 10/18 20:03 , 1 F → darkesthour 10/18 20:03,",淚溝的確很吃醫生,,
[問題] 新竹打淚溝玻尿酸的診所(或醫師),https://www.pttweb.cc/bbs/facelift/M.1729235727.A.7BC,,2024-10-18T15:15:00,", 6 F 新竹推安慎醫美，我淚溝是給陳宛玎醫師 10/22 14:38 , 6 F → Powevers 10/22 14:39,",溝是給陳宛玎醫師,新竹推安慎醫美,新竹
[問題] 眼袋內開手術容易有後遺症或復發嗎,https://www.pttweb.cc/bbs/facelift/M.1729060065.A.A9F,,2024-10-16T14:27:00,一直都有眼袋和淚溝的問題，查了很多資料也諮詢過好幾間診所，打算下下個月去做眼袋 內開轉脂肪手術，但我還沒跟公司請假，不知道要請多久，也想問問看大家眼袋手術會有 什麼後遺症嗎，一般手術動完，效果可以維持多久？很怕手術完沒多久就復發的我,,查了很多資料也諮詢過好幾間診所,
[問題] 眼袋內開手術容易有後遺症或復發嗎,https://www.pttweb.cc/bbs/facelift/M.1729060065.A.A9F,,2024-10-16T14:27:00,", 25 F 本來也想做內開眼袋手術.但醫生說我眼 10/17 17:00 , 25 F → skyionlol 10/17 17:00,",,,
[問題]想開眼袋桃園有推薦的診所嗎,https://www.pttweb.cc/bbs/facelift/M.1728572970.A.4CB,,2024-10-10T23:09:00,[問題]想開眼袋桃園有推薦的診所嗎 - 看板facelift - PTT網頁版,,想開眼袋桃園有推薦的診所,桃園
[問題]想開眼袋桃園有推薦的診所嗎,https://www.pttweb.cc/bbs/facelift/M.1728572970.A.4CB,,2024-10-10T23:09:00,"[問題]想開眼袋桃園有推薦的診所嗎 ＋收藏 分享 看板 facelift 作者 sp3573 (U妮) 時間 1年前 發表 (2024/10/10 23:09) , 1年前 編輯 推噓 10 ( 10 推 0 噓 17 → ) 留言 27則, 10人 參與 , 1年前 最新 討論串 1/1",,想開眼袋桃園有推薦的診所,桃園
[問題]想開眼袋桃園有推薦的診所嗎,https://www.pttweb.cc/bbs/facelift/M.1728572970.A.4CB,,2024-10-10T23:09:00,", 1 F 最近跟姊姊剛弄完眼袋，南崁的新顏診所 10/11 14:21 , 1 F → hankstak 10/11 14:21,",,南崁的新顏診所,
[問題]想開眼袋桃園有推薦的診所嗎,https://www.pttweb.cc/bbs/facelift/M.1728572970.A.4CB,,2024-10-10T23:09:00,", 14 F 朋友的媽媽在桃園淨漾時尚診所做眼袋外開 10/13 18:57 , 14 F → sham33 10/13 18:57,",,朋友的媽媽在桃園淨漾時尚診所,桃園
[問題]想開眼袋桃園有推薦的診所嗎,https://www.pttweb.cc/bbs/facelift/M.1728572970.A.4CB,,2024-10-10T23:09:00,", 18 F 我姐眼袋都是找院長做的，技術美感都很 10/16 13:21 , 18 F → damedame 10/16 13:21,",姐眼袋都是找院長,,
[問題] 眼袋內開、外開怎麼選？我好猶豫！,https://www.pttweb.cc/bbs/facelift/M.1728457314.A.3A1,,2024-10-09T15:01:00,", 15 F 會問醫生的建議，眼袋可以找蘇瑋智 他眼袋 10/11 14:50 , 15 F → janica 10/11 14:51,",會問醫生,,
[問題] 眼袋內開、外開怎麼選？我好猶豫！,https://www.pttweb.cc/bbs/facelift/M.1728457314.A.3A1,,2024-10-09T15:01:00,", 20 F 題外話 比起其他醫美 開眼袋cp值真的 10/15 09:29 , 20 F → Bloomlover 10/15 09:29,",,比起其他醫美,
[分享] 眼袋內開真實分享～跟考慮很久的你,https://www.pttweb.cc/bbs/facelift/M.1727880200.A.DD3,,2024-10-02T22:43:00,期待又緊張的心情真的心跳撲通撲通，諮詢師跟醫師都很專業，也沒什麼壓力的幫我諮詢 跟解答我的問題。結束後也沒有強迫推銷，我也說我要思考一下價格以及畢竟是手術(本 人從來沒有做手術過，所以真的緊張跟需要謹慎)。可想而知我真的有點小害怕，第一次 眼袋諮詢就不了了知，沒有後續進展。,諮詢師跟醫師,,
[分享] 眼袋內開真實分享～跟考慮很久的你,https://www.pttweb.cc/bbs/facelift/M.1727880200.A.DD3,,2024-10-02T22:43:00,謹慎的我~決定2023/11/11 去了同一間診所二次諮詢。 我這次做的功課更多 詢問的事情更仔細，手術時間多長啊? 怎麼方式的麻醉? 術前和術 後的相關問題，我都一一詢問。 最重要的是!!!醫生這次有說到一個重點，說我的眼袋再拖下去就可能需要做外開手術了( 哭，到時候會有縫線須要拆線，恢復期也會比較長。 當下我想說不能再拖了，是時候該衝一波，所以這次我下定決心送給自己眼袋手術的生日 禮物，想想不投資自己要投資誰啊? 把錢花在自己身上是最值得。 深呼吸一口氣後，就請諮詢師安排抽血檢查和排定了手術時間。,,去了同一間診所,
[分享] 眼袋內開真實分享～跟考慮很久的你,https://www.pttweb.cc/bbs/facelift/M.1727880200.A.DD3,,2024-10-02T22:43:00,2023/12/9 到了動手術的時間 手術前醫師會再做一次術前的溝通，好像稍微放鬆一點。 我是進行眼袋內開手術 ，傷口會在內眼瞼裡面，幾乎沒有什麼傷口。醫師有建議可以回 填淚溝，讓整體看起來更棒!!,手術前醫師,,
[分享] 眼袋內開真實分享～跟考慮很久的你,https://www.pttweb.cc/bbs/facelift/M.1727880200.A.DD3,,2024-10-02T22:43:00,手術醫生超專業跟我說是小手術，不用緊張一下就好了!!你眼袋不見之後 真的會變帥喔! ! 我心裡OS: 醫生我信你了!! 拜託了!!迌滼N前有夠緊張!!!!! (眼袋有夠明顯!!! 我自己 看了都累 T^T)ꀊ,手術醫生,,
[分享] 眼袋內開真實分享～跟考慮很久的你,https://www.pttweb.cc/bbs/facelift/M.1727880200.A.DD3,,2024-10-02T22:43:00,我是眼部局部麻醉，麻醉的時候真的是最緊張的時刻，因為醫生跟護理師有說這個步驟是 最痛的。醫生用沉穩的聲音跟我說: 好!! 那我們開始吧!! (醫生有放音樂，讓我心情比 較放鬆一點。) 麻醉可能會痛喔! 要忍耐一下。 第一針扎下去的時候，我心裡想: 喔!! 針頭很細!! 我可以忍耐的程度。沒有到痛爆!! 比拔智齒打麻醉跟擠針眼的麻醉相比，我覺得比較不痛!! 大家應該可以大略知道疼痛的 程度。但如果你很痛我沒有要負責喔!! 醫生有提醒如果感覺痛或是酸就舉手讓他知道，他再加麻藥。手術過程中，相當順利而且 很快速，整個過程...,因為醫生,,
[問題] 台南開眼袋醫生推薦？,https://www.pttweb.cc/bbs/facelift/M.1727555955.A.152,,2024-09-29T04:39:00,[問題] 台南開眼袋醫生推薦？ - 看板facelift - PTT網頁版,台南開眼袋醫生,,台南
[問題] 台南開眼袋醫生推薦？,https://www.pttweb.cc/bbs/facelift/M.1727555955.A.152,,2024-09-29T04:39:00,"[問題] 台南開眼袋醫生推薦？ ＋收藏 分享 看板 facelift 作者 kxwai (kxwai) 時間 1年前 發表 (2024/09/29 04:39) , 1年前 編輯 推噓 5 ( 5 推 0 噓 6 → ) 留言 11則, 5人 參與 , 1年前 最新 討論串 1/1",台南開眼袋醫生,,台南
[問題] 台南開眼袋醫生推薦？,https://www.pttweb.cc/bbs/facelift/M.1727555955.A.152,,2024-09-29T04:39:00,最近考慮要去開眼袋，想請問大家有沒有推薦的診所跟醫生呢？,推薦的診所跟醫生,想請問大家有沒有推薦的診所,
[問題] 台南開眼袋醫生推薦？,https://www.pttweb.cc/bbs/facelift/M.1727555955.A.152,,2024-09-29T04:39:00,"因為住在新營，目前考慮去柚欣尚水諮詢（醫生看起來不少有整型醫生, 跟文華尚水好像 同團隊） 但也考慮搭車去台南市區做，希望大家可以分享一下不錯的醫生，希望第一次開眼袋就成 功","來不少有整型醫生,享一下不錯的醫生",,台南
[問題] 台南開眼袋醫生推薦？,https://www.pttweb.cc/bbs/facelift/M.1727555955.A.152,,2024-09-29T04:39:00,", 1 F 之前就是在市區這個團隊給朱醫師開眼袋 09/29 11:10 , 1 F → betty5802 09/29 11:11,",這個團隊給朱醫師,,
[問題] 台南開眼袋醫生推薦？,https://www.pttweb.cc/bbs/facelift/M.1727555955.A.152,,2024-09-29T04:39:00,", 3 F 美美上美的蔡宗賢醫生，本人眼袋養了很 09/29 22:30 , 3 F → pony2129 09/29 22:30,",上美的蔡宗賢醫生,,
[問題] 極緻的眼袋手術評價怎麼樣,https://www.pttweb.cc/bbs/facelift/M.1726459508.A.D5C,,2024-09-16T12:05:00,最近準備去做眼袋手術 診所我目前選擇極緻 因為之前爬文的時候有看到版上有人提到他們家,,最近準備去做眼袋手術 診所我目前選擇極緻,
[問題] 極緻的眼袋手術評價怎麼樣,https://www.pttweb.cc/bbs/facelift/M.1726459508.A.D5C,,2024-09-16T12:05:00,", 11 F 移位淚溝醫師人很好,術前跟術後回診都 09/16 18:37 , 11 F → jolyzati 09/16 18:37,",移位淚溝醫師,,
[問題] 後天型眼袋想要找推薦醫生(內有診所),https://www.pttweb.cc/bbs/facelift/M.1726081420.A.87E,,2024-09-12T03:03:00,[問題] 後天型眼袋想要找推薦醫生(內有診所) - 看板facelift - PTT網頁版,袋想要找推薦醫生,內有診所,
[問題] 後天型眼袋想要找推薦醫生(內有診所),https://www.pttweb.cc/bbs/facelift/M.1726081420.A.87E,,2024-09-12T03:03:00,"[問題] 後天型眼袋想要找推薦醫生(內有診所) ＋收藏 分享 看板 facelift 作者 keneyliu (喵) 時間 1年前 發表 (2024/09/12 03:03) , 1年前 編輯 推噓 6 ( 6 推 0 噓 9 → ) 留言 15則, 5人 參與 , 1年前 最新 討論串 1/1",袋想要找推薦醫生,內有診所,
[問題] 後天型眼袋想要找推薦醫生(內有診所),https://www.pttweb.cc/bbs/facelift/M.1726081420.A.87E,,2024-09-12T03:03:00,6月中的時候參加同學會 發現以前班上人緣好的幾個女生 看起來都比我小好幾歲 因為不熟所以不好意思問他們的保養方式 回去後還是覺得有點被刺激到 感覺普通保養對自己也沒效了 所以開始查眼袋手術的資料 也有問幾個比較好的且有做過的朋友 綜合評估下想要去晶華診所諮詢 想問問有沒有推薦的醫生 希望是手術經驗豐富一點的醫生,"有沒有推薦的醫生,驗豐富一點的醫生",綜合評估下想要去晶華診所,
[問題] 後天型眼袋想要找推薦醫生(內有診所),https://www.pttweb.cc/bbs/facelift/M.1726081420.A.87E,,2024-09-12T03:03:00,", 10 F 可以去諮詢詹東峻醫生，我也是眼袋很肥 09/16 19:05 , 10 F → angel75 09/16 19:05,",去諮詢詹東峻醫生,,
[問題] 眼袋用熊貓針有效嗎還是直接手術,https://www.pttweb.cc/bbs/facelift/M.1725854804.A.942,,2024-09-09T12:06:00,", 41 F 我很久之前找去蘇黎世找蘇院長做眼袋手術 09/13 17:53 , 41 F → Kane514 09/13 17:53,",去蘇黎世找蘇院長,,
[問題] 媽媽 眼袋 法令紋問題 求推薦醫師,https://www.pttweb.cc/bbs/facelift/M.1725796850.A.DD9,,2024-09-08T20:00:00,[問題] 媽媽 眼袋 法令紋問題 求推薦醫師 - 看板facelift - PTT網頁版,求推薦醫師,,
[問題] 媽媽 眼袋 法令紋問題 求推薦醫師,https://www.pttweb.cc/bbs/facelift/M.1725796850.A.DD9,,2024-09-08T20:00:00,"[問題] 媽媽 眼袋 法令紋問題 求推薦醫師 ＋收藏 分享 看板 facelift 作者 cafecoffee ( ) 時間 1年前 發表 (2024/09/08 20:00) , 編輯 推噓 7 ( 7 推 0 噓 22 → ) 留言 29則, 9人 參與 , 1年前 最新 討論串 1/1",求推薦醫師,,
[問題] 媽媽 眼袋 法令紋問題 求推薦醫師,https://www.pttweb.cc/bbs/facelift/M.1725796850.A.DD9,,2024-09-08T20:00:00,最近一直以來對我會去打雷射做醫美很有意見的媽媽（60歲）突然說他想去弄眼袋，又說 他眼睛垂（變小）、臉也垂，好像是周遭朋友建議他進廠維修一下。,,最近一直以來對我會去打雷射做醫美,
