thread_title,thread_url,thread_author,thread_datetime,snippet,doctors,clinics,city
[討論] 高雄雙眼皮與淚溝眼袋診所選擇,https://www.pttweb.cc/bbs/facelift/M.1655526495.A.20E,,2022-06-18T12:28:00,"[討論] 高雄雙眼皮與淚溝眼袋診所選擇 ＋收藏 分享 看板 facelift 作者 Racheliu (淡了，忘了，笑了) 時間 3年前 發表 (2022/06/18 12:28) , 3年前 編輯 推噓 10 ( 10 推 0 噓 10 → ) 留言 20則, 12人 參與 , 最新 討論串 1/1",,高雄雙眼皮與淚溝眼袋診所,高雄
[討論] 高雄雙眼皮與淚溝眼袋診所選擇,https://www.pttweb.cc/bbs/facelift/M.1655526495.A.20E,,2022-06-18T12:28:00,因年紀漸增，近日想趁居家少進辦公室的時間進行雙眼皮與跟淚溝眼袋手術， 已經去諮詢了四位醫師，但有點難決定，想請版友們給點建議。,去諮詢了四位醫師,,
[討論] 高雄雙眼皮與淚溝眼袋診所選擇,https://www.pttweb.cc/bbs/facelift/M.1655526495.A.20E,,2022-06-18T12:28:00,3. 時尚假期姚勝發 姚醫師認為我有條件用縫的就可以，但建議會縫稍微寬一點點預留下垂的空間， 但也不能太寬，因為眉眼距離不大。 建議開眼頭，因為右眼蒙古摺比較大，如果不開只是拉高眼皮寬度看起來不順。 八字縫40000，開眼頭30000，一起做60000。 眼袋內開45000，淚溝＋補蘋果肌 45000，一起做60000。 全部一起做120000。,,,
[討論] 高雄雙眼皮與淚溝眼袋診所選擇,https://www.pttweb.cc/bbs/facelift/M.1655526495.A.20E,,2022-06-18T12:28:00,診所環境新穎，醫師跟諮詢師都極為親切，沒有倉促趕時間的感覺，也多次模擬眼型。 店長的眼袋＆某位醫美師的雙眼皮也都是姚院長做的，看過前後比對感覺是蠻美的。,眼皮也都是姚院長,某位醫美,
[討論] 高雄雙眼皮與淚溝眼袋診所選擇,https://www.pttweb.cc/bbs/facelift/M.1655526495.A.20E,,2022-06-18T12:28:00,4. 沐妍程以長 唯一一個沒有給我鏡子，是直接用拍照模擬眼型，用照片說明給我看的醫生。 認為我眼睛拋，需要用割的取掉一些眼皮才會自然，蒙古摺的緣故建議開眼頭 做半開放式的。 割+開眼頭65000 認為眼袋淚溝都不嚴重，可以內開將脂肪下推即可，不需要補脂補蘋果肌。 內開眼袋60000。 一起做120000,說明給我看的醫生,,
[討論] 高雄雙眼皮與淚溝眼袋診所選擇,https://www.pttweb.cc/bbs/facelift/M.1655526495.A.20E,,2022-06-18T12:28:00,", 2 F 眼袋沒表情時就會出現，圖片只有輕微淚溝 06/18 14:06 , 2 F 忘記哪位醫生是有說笑起來厚厚的那個是臥蠶，屬於動態肌肉不能動， 但右眼淚溝下方有一點點眼袋，只是不嚴重",忘記哪位醫生,,
[討論] 高雄雙眼皮與淚溝眼袋診所選擇,https://www.pttweb.cc/bbs/facelift/M.1655526495.A.20E,,2022-06-18T12:28:00,", 7 F 推1 在義大給黃醫師做眼袋 很滿意 06/18 20:19 , 7 F 看到對黃醫師的評論真的都是好評，所以我第一間也是諮詢他","在義大給黃醫師,看到對黃醫師",,
[討論] 高雄雙眼皮與淚溝眼袋診所選擇,https://www.pttweb.cc/bbs/facelift/M.1655526495.A.20E,,2022-06-18T12:28:00,"推 wij51271 07/07 15:45, , 13 F 大推3 07/07 15:45 , 13 F 推 viki0730 09/16 20:48, , 14 F 想請問原po能分享術後的照片嗎～謝謝 09/16 20:48 , 14 F 推 Maisie6 02/14 21:55, , 15 F 高雄我推雅斯翠孫一峯喔 診所很寬敞舒適 02/14 21:55 , 15 F → Maisie6 02/14 21:57, , 16 F 不像很多醫美診所小小擠擠的 隱私性不錯 02/14 21:57 , 16 F...",,不像很多醫美診所,高雄
[心得] 打了蘋果肌竟然同時解救淚溝跟法令紋，C,https://www.pttweb.cc/bbs/facelift/M.1655484599.A.D1B,,2022-06-18T00:49:00,面對這樣子的凹陷老態的臉 我自己也知道保養品跟吃膠原蛋白是無法改善到我想要的樣子 真的只能靠醫美了 上網做了功課，我自己是推估應該淚溝問題最嚴重 但沒想到給醫生諮詢的時候，醫生反而建議我優先改善蘋果肌問題 跟我解釋說蘋果肌打完，淚溝也會相對改善 如果後續有需要再來補( 醫生人也太好了，不想賺錢嗎？),但沒想到給醫生,真的只能靠醫美,
[心得] 打了蘋果肌竟然同時解救淚溝跟法令紋，C,https://www.pttweb.cc/bbs/facelift/M.1655484599.A.D1B,,2022-06-18T00:49:00,不知道是不是打了蘋果肌，除了淚溝變淡之外，法令紋也好像有變好耶！ 有種摸蜊仔兼洗褲，賺到的概念 現在拍照起來，感覺整體有比較年輕許多，現在笑起來也很自然 一周回診後，醫生也說我的狀態很好，應該不大需要再補 比對起來也覺得真的差異很大,,,
[心得] 打了蘋果肌竟然同時解救淚溝跟法令紋，C,https://www.pttweb.cc/bbs/facelift/M.1655484599.A.D1B,,2022-06-18T00:49:00,", 27 F 凹凸真的看得出來，效果很好 06/20 21:40 , 27 F 嗨！各位！前幾天排班沒有空來板上看看！我在君綺診所打的，幫我解決頰凹跟淚溝問題的 醫生是沈茂昌，總共打2CC，費用不到一萬五喔！",,我在君綺診所,
[心得] 玻尿酸拯救了我的萬年淚溝,https://www.pttweb.cc/bbs/facelift/M.1655371439.A.6A5,,2022-06-16T17:23:00,但我沒什麼在做醫美，頂多去除毛而已，完全沒什麼經驗俗稱醫美小白，雖然中間都有去 諮詢過幾間診所，可是遲遲不敢施打，很怕打了會不會不自然或是看起來很假，所以一拖 再拖。 最近跟朋友吃飯聊天的時候，發現她變得很美很精緻，可是又看不出來她到底哪裡不一樣 ，她才跟我說她去打了法令紋跟下巴，剛打完3天而已，我心中驚為天人！也太自然了吧 ！快告訴我去哪打找哪位醫師！！！心動不如馬上行動，立刻打電話去預約萊o診所的王o 良醫師 為什麼要找王醫師呢，因為我朋友史上最怕痛，居然沒上麻藥直接來，那我不找王醫師不 就虐待自己嗎！ 諮詢的...,"去哪打找哪位醫師,為什麼要找王醫師,那我不找王醫師","但我沒什麼在做醫美,完全沒什麼經驗俗稱醫美,諮詢過幾間診所,立刻打電話去預約萊o診所,怪不會像我以前看到別人都覺得這人一定有做醫美",
玻尿酸拯救了我的萬年淚溝已刪文,https://www.pttweb.cc/bbs/facelift/M.1655371289.A.E21,,2022-06-16T17:21:00,但我沒什麼在做醫美，頂多去除毛而已，完全沒什麼經驗俗稱醫美小白，雖然中間都有去 諮詢過幾間診所，可是遲遲不敢施打，很怕打了會不會不自然或是看起來很假，所以一拖 再拖。 最近跟朋友吃飯聊天的時候，發現她變得很美很精緻，可是又看不出來她到底哪裡不一樣 ，她才跟我說她去打了法令紋跟下巴，剛打完3天而已，我心中驚為天人！也太自然了吧 ！快告訴我去哪打找哪位醫師！！！心動不如馬上行動，立刻打電話去預約萊o診所的王o 良醫師 為什麼要找王醫師呢，因為我朋友史上最怕痛，居然沒上麻藥直接來，那我不找王醫師不 就虐待自己嗎！ 諮詢的...,"去哪打找哪位醫師,為什麼要找王醫師,那我不找王醫師","但我沒什麼在做醫美,完全沒什麼經驗俗稱醫美,諮詢過幾間診所,立刻打電話去預約萊o診所,怪不會像我以前看到別人都覺得這人一定有做醫美",
[分享] 猶豫很久終於下手的眼袋內開,https://www.pttweb.cc/bbs/facelift/M.1655355065.A.DFD,,2022-06-16T12:51:00,內開當天我的狀況蠻慘的 全麻醒來後一直吐 又冷 可能對麻醉敏感 醫生有打止吐針 回家一直很累想睡 隔天精神就好非常多,,,
[分享] 猶豫很久終於下手的眼袋內開,https://www.pttweb.cc/bbs/facelift/M.1655355065.A.DFD,,2022-06-16T12:51:00,我的選擇是內開眼袋 眼袋脂肪移位 但是沒有抽脂補臉 醫生本來建議一次到位 但是我擔心恢復期要很久 因為還要上班,,,
[分享] 猶豫很久終於下手的眼袋內開,https://www.pttweb.cc/bbs/facelift/M.1655355065.A.DFD,,2022-06-16T12:51:00,"推 Communique02 06/20 17:16, , 6 F 好勇敢!! 06/20 17:16 , 6 F 推 powerlion 06/21 23:17, , 7 F 請問診所醫生和價錢，謝謝 06/21 23:17 , 7 F → LOVEPAUL 06/21 23:30, , 8 F 請問診所醫生和價錢，謝謝 06/21 23:30 , 8 F 推 mc76258 06/23 23:20, , 9 F 淚溝還是挺明顯,但跟原先比有進步 06/23 23:20 , 9 F ‣ 返回看板 [ faceli...",請問診所醫生,請問診所,
[討論] 過敏型黑眼圈打熊貓針沒用？,https://www.pttweb.cc/bbs/facelift/M.1654761214.A.D6D,,2022-06-09T15:53:00,之前諮詢過醫美診所 她說我的黑眼圈是過敏型，打了效果不明顯 反而建議我打染料雷射去除痘疤,,之前諮詢過醫美診所,
[討論] 過敏型黑眼圈打熊貓針沒用？,https://www.pttweb.cc/bbs/facelift/M.1654761214.A.D6D,,2022-06-09T15:53:00,但最近我自己也覺得黑眼圈很顯疲態很顯老 所以很在意＠＠ 但又不想花冤枉錢，網路上查到的也大多是醫美合作文章 想問一下有相同狀況的人施打後的效果和維持度如何？,,網路上查到的也大多是醫美,
[問題] 想問黑眼圈雷射適合的人,https://www.pttweb.cc/bbs/facelift/M.1654530047.A.D40,,2022-06-06T23:40:00,", 8 F 每個人狀況不一樣，直接請醫師評估最好 06/09 17:30 , 8 F → DareJ 06/27 15:05, , 9 F 去不同家諮詢也不一樣 我也是黑眼圈 某廣告 06/27 15:05 , 9 F → DareJ 06/27 15:05, , 10 F 打很大醫美諮詢師一去就一直推我玻尿酸 06/27 15:05 , 10 F → DareJ 06/27 15:06, , 11 F 去另一間是醫生說打雷射即可 大家不要腦弱 06/27 15:06 , 11 F ‣ 返回看板 [ facelif...","直接請醫師,去另一間是醫生",打很大醫美,
[問題] 想帶媽媽去做眼袋手術，有推薦的醫師嗎？,https://www.pttweb.cc/bbs/facelift/M.1654052595.A.368,,2022-06-01T11:03:00,[問題] 想帶媽媽去做眼袋手術，有推薦的醫師嗎？ - 看板facelift - PTT網頁版,有推薦的醫師,,
[問題] 想帶媽媽去做眼袋手術，有推薦的醫師嗎？,https://www.pttweb.cc/bbs/facelift/M.1654052595.A.368,,2022-06-01T11:03:00,"[問題] 想帶媽媽去做眼袋手術，有推薦的醫師嗎？ ＋收藏 分享 看板 facelift 作者 metroli (metroli) 時間 3年前 發表 (2022/06/01 11:03) , 編輯 推噓 6 ( 6 推 0 噓 18 → ) 留言 24則, 10人 參與 , 最新 討論串 1/1",有推薦的醫師,,
[問題] 想帶媽媽去做眼袋手術，有推薦的醫師嗎？,https://www.pttweb.cc/bbs/facelift/M.1654052595.A.368,,2022-06-01T11:03:00,我媽最近很在意自己眼袋變很明顯，老是問我是不是看起來很老很沒精神 想說他那麼在意乾脆帶他去做眼袋手術 目前有挑了幾位醫師在考慮 因為是開眼睛的手術，還是有點怕怕的 想問各位有去開過眼袋手術的經驗可以分享一下嗎？感謝！ (目前在考慮這幾位) 選手1 劉淳熙醫師 選手2 楊弘旭醫師 選手3 錢逸群醫師,"前有挑了幾位醫師,劉淳熙醫師,楊弘旭醫師,錢逸群醫師",,
[問題] 想帶媽媽去做眼袋手術，有推薦的醫師嗎？,https://www.pttweb.cc/bbs/facelift/M.1654052595.A.368,,2022-06-01T11:03:00,", 2 F 推錢逸群醫生～我媽也是給他做眼袋內開 06/01 13:33 , 2 F → Cientbla 06/01 13:33,",推錢逸群醫生,,
[問題] 眼下問題(黑眼圈/眼袋)處理,https://www.pttweb.cc/bbs/facelift/M.1653874814.A.5C4,,2022-05-30T09:40:00,一直以來都為了眼下的黑眼圈困擾(鼻過敏)，最近去版上知名的三明治微整診所諮詢,,最近去版上知名的三明治微整診所,
[問題] 眼下問題(黑眼圈/眼袋)處理,https://www.pttweb.cc/bbs/facelift/M.1653874814.A.5C4,,2022-05-30T09:40:00,", 6 F 前陣子也有去諮詢黑眼圈 醫生有提到 05/30 16:14 , 6 F → loveisth520 05/30 16:15,",,,
[分享] 高雄眼袋內開 術後兩周熱騰騰分享！,https://www.pttweb.cc/bbs/facelift/M.1653303632.A.39F,,2022-05-23T19:00:00,後來漸漸有處理眼袋的念頭 在這行當然多少要打聽一下哪個醫師技術好 剛好有好姐妹是開刀房護理師 看過很多醫師開刀手法 細緻度 縫合功力（這些真的很重要！ 聽好姐妹的推薦 再綜合病房的口耳相傳 終於選定醫師就衝了！,"打聽一下哪個醫師,看過很多醫師,終於選定醫師",,
[分享] 高雄眼袋內開 術後兩周熱騰騰分享！,https://www.pttweb.cc/bbs/facelift/M.1653303632.A.39F,,2022-05-23T19:00:00,", 15 F 請問有補淚溝嗎？想知道醫生資訊～謝 05/23 23:57 , 15 F → asteroidea 05/23 23:57,",想知道醫生,,
[分享] 高雄眼袋內開 術後兩周熱騰騰分享！,https://www.pttweb.cc/bbs/facelift/M.1653303632.A.39F,,2022-05-23T19:00:00,", 35 F 請問診所醫生及費用，謝謝！ 05/24 10:24 , 35 F 向下載入更多 還有 175 則推文 還有 11 段內文 載入全部 向上載入更多 → case110 10/30 13:57, , 211 F 請問醫師及費用，謝謝 10/30 13:57 , 211 F 推 tfgpink 11/02 12:31, , 212 F 請問醫師跟費用，謝謝！ 11/02 12:31 , 212 F 推 chiyu27 11/04 09:34, , 213 F 請問醫師及費用，謝謝！ 11/04 09:34 ...","請問診所醫生,請問醫師,想請問診所醫生,想請問醫生,想問醫生,想請問診所醫師,想知道診所醫生","請問診所,想了解那間診所,想請問診所,想詢問診所,想請教診所,想知道診所",
[討論] 黑眼圈改善方法請教,https://www.pttweb.cc/bbs/facelift/M.1653216883.A.DDF,,2022-05-22T18:54:00,"請教一下各位 最近幫女友問了幾間新竹-頭份地區的醫美整所 為了治療黑眼圈大致上諮詢了一輪 結論就是玻尿酸填充+熊貓針or雷射治療居多 玻尿酸1cc的價格8500-15000都有 熊貓針1cc的價格9999-14000左右 複合式雷射打眼周單堂課的價格一堂2500-5000的都有(一次買多堂都有優惠) 雷射太多種,價格帶也很廣,每間差異都很大",,頭份地區的醫美,新竹
[問題] 請問眼袋手術術後冰敷問題,https://www.pttweb.cc/bbs/facelift/M.1653179788.A.C4A,,2022-05-22T08:36:00,前幾天做了內開眼袋+自體脂肪補脂蘋果肌的手術 術後在診所恢復觀察時護理師有幫我冰敷（只有冰敷眼皮） 但我印象中並沒有提到蘋果肌的部份不能冰敷 於是術後三天我在家就很勤勞的冰敷眼皮和蘋果肌了@@ 結果昨天才看到有人的分享文中提到補脂的部份不能冰敷，因為會造成自體脂肪萎縮死亡 OMG 請問這樣影響會很大嗎 如果之後覺得不滿意請醫師再補一次 是要重新再抽一次脂肪對嗎,覺得不滿意請醫師,術後在診所,
[分享] 再見了我的眼袋 台北眼袋內開分享,https://www.pttweb.cc/bbs/facelift/M.1652692397.A.89F,,2022-05-16T17:13:00,", 39 F 想問醫生及價格！謝謝～ 05/17 11:56 , 39 F 向下載入更多 還有 140 則推文 載入全部 向上載入更多 推 ApriLW 07/16 00:51, , 180 F 想請問醫生及價格～謝謝 07/16 00:51 , 180 F 推 dogypoo 07/19 01:29, , 181 F 請問醫生及費用，謝謝！ 07/19 01:29 , 181 F 推 amyxxx 07/19 05:31, , 182 F 想詢問醫生跟價格謝謝 07/19 05:31 , 182 F 推 Gros...","想問醫生,想請問醫生,請問醫生,想詢問醫生,請問醫師,想問醫師,想請問醫師,現在問醫生,也想問醫師,價錢跟診所及醫師,請問診所醫生,想詢問診所醫生,想知道醫生","請問醫師診所,請問診所,現在問醫生診所,價錢及診所,想詢問割眼袋價錢跟診所,想請問醫師價錢及診所,想詢問診所",
[問題] 關於淚溝診所選擇已刪文,https://www.pttweb.cc/bbs/facelift/M.1652494615.A.7D2,,2022-05-14T10:16:00,[問題] 關於淚溝診所選擇 - 看板facelift - PTT網頁版,,關於淚溝診所,
[問題] 關於淚溝診所選擇已刪文,https://www.pttweb.cc/bbs/facelift/M.1652494615.A.7D2,,2022-05-14T10:16:00,"[問題] 關於淚溝診所選擇 已刪文 ＋收藏 分享 看板 facelift 作者 zz8359286 (jujoC) 時間 3年前 發表 (2022/05/14 10:16) , 編輯 推噓 5 ( 5 推 0 噓 3 → ) 留言 8則, 6人 參與 , 3年前 最新 討論串 1/1",,關於淚溝診所,
[問題] 關於淚溝診所選擇已刪文,https://www.pttweb.cc/bbs/facelift/M.1652494615.A.7D2,,2022-05-14T10:16:00,最近想處理自己淚溝部分， 目前傾向打保柔緹（水無痕）玻尿酸～ 但爬文好久大部分都w頂ㄐ跟粹ㄐ， 想詢問北部跟中部是否還有推薦得診所～～,,想詢問北部跟中部是否還有推薦得診所,
[問題] 關於淚溝診所選擇已刪文,https://www.pttweb.cc/bbs/facelift/M.1652494615.A.7D2,,2022-05-14T10:16:00,", 2 F 也想知道玻尿酸打淚溝，推薦的北部診所 05/14 15:18 , 2 F 推 whereislove 05/14 17:02,",,推薦的北部診所,
[問題] 關於淚溝診所選擇已刪文,https://www.pttweb.cc/bbs/facelift/M.1652494615.A.7D2,,2022-05-14T10:16:00,", 7 F 推1樓 我也有給靚白張院長打水無痕補淚溝 05/17 11:50 , 7 F → Wendyjj 05/17 11:52,",也有給靚白張院長,,
[討論] 眼周按摩對眼袋改善有幫助嗎?,https://www.pttweb.cc/bbs/facelift/M.1652261015.A.55D,,2022-05-11T17:23:00,", 19 F 參考醫師對於眼袋的衛教影片 05/12 22:31 , 19 F → seamaple 05/12 22:31,",參考醫師,,
[討論] 眼周按摩對眼袋改善有幫助嗎?,https://www.pttweb.cc/bbs/facelift/M.1652261015.A.55D,,2022-05-11T17:23:00,"推 Motorio 05/24 11:26, , 21 F 眼霜、眼罩熱敷、眼球運動都試過 都沒效 05/24 11:26 , 21 F → Motorio 05/24 11:27, , 22 F …還是醫美唯一解 05/24 11:27 , 22 F 推 yannnnni520 05/24 11:31, , 23 F 極緻做眼袋+1 我是給杜醫生~還有做 05/24 11:31 , 23 F → yannnnni520 05/24 11:31, , 24 F 蘋果肌補脂,真的很值得!! 05/24 11:31 ,...","我是給杜醫生,推羅國銓醫師",還是醫美,
[問題] 台中內開眼袋手術醫師,https://www.pttweb.cc/bbs/facelift/M.1652152166.A.E8B,,2022-05-10T11:09:00,[問題] 台中內開眼袋手術醫師 - 看板facelift - PTT網頁版,內開眼袋手術醫師,,台中
[問題] 台中內開眼袋手術醫師,https://www.pttweb.cc/bbs/facelift/M.1652152166.A.E8B,,2022-05-10T11:09:00,"[問題] 台中內開眼袋手術醫師 ＋收藏 分享 看板 facelift 作者 RubyMendoza (露比門多薩) 時間 3年前 發表 (2022/05/10 11:09) , 編輯 推噓 9 ( 9 推 0 噓 13 → ) 留言 22則, 8人 參與 , 最新 討論串 1/1",內開眼袋手術醫師,,台中
[問題] 台中內開眼袋手術醫師,https://www.pttweb.cc/bbs/facelift/M.1652152166.A.E8B,,2022-05-10T11:09:00,雖然從小就有眼袋，但應該還算年輕(不到40歲)，皮膚彈性應該夠，所以想做內開眼袋手 術就好，想要請大家推薦醫師，再挑喜歡的案例去問,要請大家推薦醫師,,
[問題] 台中內開眼袋手術醫師,https://www.pttweb.cc/bbs/facelift/M.1652152166.A.E8B,,2022-05-10T11:09:00,", 16 F 台中眼袋的話李博文醫生滿有名的，可以去多 05/12 10:32 , 16 F 推 yabiS 05/12 10:37,",袋的話李博文醫生,,台中
[問題] 台中內開眼袋手術醫師,https://www.pttweb.cc/bbs/facelift/M.1652152166.A.E8B,,2022-05-10T11:09:00,", 18 F 484可以打看看艾利斯啊?? 05/12 18:20 , 18 F 推 linading 05/22 00:28, , 19 F 大概半年前有在君綺給蔡X達醫生做眼袋 05/22 00:28 , 19 F → linading 05/22 00:28, , 20 F 內開，因為眼皮老化速度還沒有很嚴重， 05/22 00:28 , 20 F → linading 05/22 00:28, , 21 F 所以只有做內開，術後腫脹大概兩周，現 05/22 00:28 , 21 F → linading 0...",君綺給蔡X達醫生,,
[問題] 單邊眼袋要補脂還是直接拿掉,https://www.pttweb.cc/bbs/facelift/M.1652126715.A.460,,2022-05-10T04:05:00,基本上醫生覺得補脂就可以了，而我猶豫的點是：,基本上醫生,,
[心得] 台北眼袋內開補脂心得,https://www.pttweb.cc/bbs/facelift/M.1651945253.A.BEB,,2022-05-08T01:40:00,其實我覺得我右眼還是有點淚溝感 但醫生表示因為我眼頭比較白、黑眼圈比較深 所以會有分界線，看起來就還有淚溝 但實際摸是平的，不是凹的,,,
[問題] 台中淚溝補脂 求推薦,https://www.pttweb.cc/bbs/facelift/M.1651934348.A.D14,,2022-05-07T22:39:00,想請各位版友推薦 台中有沒有淚溝補脂厲害的醫生 因為自己從小就有淚溝 發現年近三十狀況越發嚴重 便跑了幾家醫美診所 問了一下自己眼下狀況 幾乎都是建議我 內開眼袋+脂肪回填+補小蘋果肌 知道自體脂肪有存活率的問題 但更令我擔心的是遇到不好的醫生 會造成眼下毛毛蟲的情形產生 因為不曾接觸過醫美 動刀也怕是一輩子的事情 求問版友們意見 麻煩了 謝謝大家！ ----- Sent from JPTT on my iPhone,"溝補脂厲害的醫生,是遇到不好的醫生","便跑了幾家醫美診所,因為不曾接觸過醫美",台中
[問題] 台中淚溝補脂 求推薦,https://www.pttweb.cc/bbs/facelift/M.1651934348.A.D14,,2022-05-07T22:39:00,"→ juihungchu 05/18 18:38, , 1 F 推薦給君綺的廖峻毅醫師做看看喔！他 05/18 18:38 , 1 F → juihungchu 05/18 18:38, , 2 F 眼周眼睛的手術都非常專業。之前媽媽 05/18 18:38 , 2 F 推 juihungchu 05/18 18:40, , 3 F 推薦給君綺的廖峻毅醫師做看看喔！他 05/18 18:40 , 3 F → juihungchu 05/18 18:40, , 4 F 眼周眼睛的手術都非常專業。之前媽媽 05/18 ...",君綺的廖峻毅醫師,,
[心得] 補淚溝兩個月分享…難以言喻的心得…,https://www.pttweb.cc/bbs/facelift/M.1651504583.A.F48,,2022-05-02T23:16:00,醫美版首發～受益於眾版友的心得文，今天也來分享補淚溝兩個月的心得,,,
[心得] 補淚溝兩個月分享…難以言喻的心得…,https://www.pttweb.cc/bbs/facelift/M.1651504583.A.F48,,2022-05-02T23:16:00,哎會想分享這篇，是因為今天去做例行的雷射保養，就順便請醫師評估一下我的淚溝該如 何改善。,就順便請醫師,,
[心得] 補淚溝兩個月分享…難以言喻的心得…,https://www.pttweb.cc/bbs/facelift/M.1651504583.A.F48,,2022-05-02T23:16:00,", 2 F 精靈針淚溝，施打技術跟醫師態度真 05/02 23:48 , 2 F → hedgehog112 05/02 23:48,",施打技術跟醫師,,
[心得] 補淚溝兩個月分享…難以言喻的心得…,https://www.pttweb.cc/bbs/facelift/M.1651504583.A.F48,,2022-05-02T23:16:00,", 19 F 其實給楊醫師評估時有說我是淚溝+眼袋， 05/03 08:29 , 19 F → wl21919 05/03 08:30,",其實給楊醫師,,
[心得] 補淚溝兩個月分享…難以言喻的心得…,https://www.pttweb.cc/bbs/facelift/M.1651504583.A.F48,,2022-05-02T23:16:00,", 62 F 眼袋手術CP值超高 選對醫師 做了不會後 05/04 01:26 , 62 F → seamaple 05/04 01:26,",選對醫師,,
[心得] 補淚溝兩個月分享…難以言喻的心得…,https://www.pttweb.cc/bbs/facelift/M.1651504583.A.F48,,2022-05-02T23:16:00,", 68 F 我沒做眼袋內開是因為璞之妍林醫師跟粹究 05/04 11:16 , 68 F → wi70287 05/04 11:16,",因為璞之妍林醫師,,
[心得] 補淚溝兩個月分享…難以言喻的心得…,https://www.pttweb.cc/bbs/facelift/M.1651504583.A.F48,,2022-05-02T23:16:00,", 71 F 楊醫師覺得我媽眼袋打三明治改善有限 05/04 11:30 , 71 F → judy82713 05/04 11:30,",,,
[問題] 準新娘想去做眼袋手術,https://www.pttweb.cc/bbs/facelift/M.1651405224.A.6D9,,2022-05-01T19:40:00,大家好，想詢問板上做過眼袋手術的前輩有沒有推薦哪位醫師以及選擇哪種手術，我是今 年5月底要拍婚紗，7月中要準備結婚的準新娘，住在台北。,沒有推薦哪位醫師,,台北
[問題] 準新娘想去做眼袋手術,https://www.pttweb.cc/bbs/facelift/M.1651405224.A.6D9,,2022-05-01T19:40:00,眼袋其實已經困擾我很多年，但是因為我本身很容易焦慮跟恐慌，一直鼓不起勇氣去做眼 袋手術…（怕痛…怕失敗…想到就失眠）。可是這幾天想說，婚期將近，不希望留下遺憾 ，想說還是鼓起勇氣去做手術好了，也有比較過板上大大推薦的醫師，目前有在考慮的是 蕭奕君醫師和李台生醫師，有大致上看過版友們的反饋，李醫師的復原期似乎比較短，只 是我看到的反饋相對來說比較少一些，想請問版友們有沒有相關經驗能分享（特別是李醫 生的），其他醫師如果很推薦也希望前輩們能跟我分享，謝謝～,"上大大推薦的醫師,蕭奕君醫師,和李台生醫師,其他醫師",,
[問題] 準新娘想去做眼袋手術,https://www.pttweb.cc/bbs/facelift/M.1651405224.A.6D9,,2022-05-01T19:40:00,", 1 F 我就是在李台生醫師做眼袋，不但恢復期很 05/01 20:34 , 1 F → aa0628 05/01 20:35,",就是在李台生醫師,,
[問題] 求救我的超嚴重的法令紋+淚溝,https://www.pttweb.cc/bbs/facelift/M.1651156672.A.FF2,,2022-04-28T22:37:00,", 19 F 我也是黑眼圈很重！我上週諮詢醫生建 04/29 15:33 , 19 F → debby91219 04/29 15:33,",我上週諮詢醫生,,
[問題] 求救我的超嚴重的法令紋+淚溝,https://www.pttweb.cc/bbs/facelift/M.1651156672.A.FF2,,2022-04-28T22:37:00,", 20 F 議打伊蓮絲～ 04/29 15:33 , 20 F 推 yabiS 05/09 13:43, , 21 F 眼袋可能要手術，法令紋可以先補玻尿酸 05/09 13:43 , 21 F 推 kyrinhuang 05/11 17:15, , 22 F 不說我以為看到我之前的淚溝，我之前 05/11 17:15 , 22 F → kyrinhuang 05/11 17:15, , 23 F 去君綺給邱X婷醫生打玻尿酸，狀態現 05/11 17:15 , 23 F → kyrinhuang 05/11 17...",君綺給邱X婷醫生,,
[問題] 黑眼圈改善求建議,https://www.pttweb.cc/bbs/facelift/M.1650989142.A.D89,,2022-04-27T00:05:00,年紀越來越大，黑眼圈的問題越來越嚴重 ㄧ直都很羨慕素顏時好氣色的人 偏偏我就是看起來黑眼圈ㄧ直很嚴重的人 本來以為自己是眼袋淚溝型黑眼圈的人 五六年前打過玻尿酸補淚溝 最近想做眼袋內開 找了醫生諮詢 醫生竟然跟我說我的玻尿酸還在啊 根本沒有什麼眼袋問題不要浪費錢了,找了醫生,,
